{
  "$schema": "https://json-schema.org/draft/2020-12/schema",
  "title": "Immutable Thai lesson approval receipt",
  "type": "object",
  "required": [
    "schema_version",
    "lesson_id",
    "revision",
    "approved_sentence_ids",
    "content_sha256",
    "approved_at"
  ],
  "properties": {
    "schema_version": {"const": 1},
    "lesson_id": {"type": "string"},
    "revision": {"type": "integer", "minimum": 1},
    "approved_sentence_ids": {
      "type": "array",
      "minItems": 20,
      "maxItems": 20,
      "uniqueItems": true
    },
    "content_sha256": {"type": "string", "pattern": "^[a-f0-9]{64}$"},
    "approved_at": {"type": "string"}
  }
}
