{
  "schema_version": 1,
  "lesson_id": "day-001",
  "revision": 3,
  "approved_sentence_ids": [
    "d001-s01", "d001-s02", "d001-s03", "d001-s04", "d001-s05",
    "d001-s06", "d001-s07", "d001-s08", "d001-s09", "d001-s10",
    "d001-s11", "d001-s12", "d001-s13", "d001-s14", "d001-s15",
    "d001-s16", "d001-s17", "d001-s18", "d001-s19", "d001-s20"
  ],
  "content_sha256": "b0c14c9eb413c8b8452c83a6fe0653b14aa9c9e79821baf8ddc1ca34cb0170f8",
  "approved_at": "2026-09-03T17:25:31Z"
}
