{
  "schema_version": 1,
  "lesson_id": "day-003",
  "revision": 1,
  "approved_sentence_ids": [
    "d003-s01",
    "d003-s02",
    "d003-s03",
    "d003-s04",
    "d003-s05",
    "d003-s06",
    "d003-s07",
    "d003-s08",
    "d003-s09",
    "d003-s10",
    "d003-s11",
    "d003-s12",
    "d003-s13",
    "d003-s14",
    "d003-s15",
    "d003-s16",
    "d003-s17",
    "d003-s18",
    "d003-s19",
    "d003-s20"
  ],
  "content_sha256": "8c4d57d06d4fbf4f9b24b808e3258304f973fda7c7a48b86214e6f087741df65",
  "approved_at": "2026-09-05T22:25:08Z"
}
